{
  "$schema": "https://json-schema.org/draft/2020-12/schema",
  "$id": "https://github.com/vaugouin/open-credits/schema/submission.schema.json",
  "title": "open-credits submission",
  "description": "submission.json, the data of one submission bundle: one run of the client on one copy of a work. Layers 0 to 3 of doc/data-model.md. Data only: no file path, no SQL, no contributor identity (the master takes it from the authenticated account). Every object is closed (additionalProperties false), so an unknown field, a file path among them, is rejected. References between objects (frame_ids, line_ids, entity refs) are checked by the importer, since JSON Schema cannot.",
  "type": "object",
  "additionalProperties": false,
  "required": ["format_version", "submission", "work", "copy", "segments"],
  "properties": {
    "format_version": {
      "description": "Version of this format (semantic versioning). The importer refuses a major version it does not know.",
      "type": "string",
      "pattern": "^0\\.1\\.[0-9]+$"
    },
    "submission": { "$ref": "#/$defs/submission" },
    "work": { "$ref": "#/$defs/work" },
    "copy": { "$ref": "#/$defs/copy" },
    "segments": {
      "type": "array",
      "minItems": 1,
      "items": { "$ref": "#/$defs/segment" }
    },
    "entities": {
      "description": "Entities the client proposes for its credits: persons, companies, places, songs. Local to the bundle; the master matches them to its own entities by external ids, or sends them to the disambiguation queue.",
      "type": "array",
      "items": { "$ref": "#/$defs/entity" }
    }
  },
  "$defs": {
    "uuid": {
      "description": "UUID version 7, lower case, generated by the client. Rows that belong to the submission keep it in the master.",
      "type": "string",
      "pattern": "^[0-9a-f]{8}-[0-9a-f]{4}-7[0-9a-f]{3}-[89ab][0-9a-f]{3}-[0-9a-f]{12}$"
    },
    "ms": {
      "description": "A time in milliseconds.",
      "type": "integer",
      "minimum": 0
    },
    "language": {
      "description": "BCP 47 language tag: fr, en, de-CH, pt-BR.",
      "type": "string",
      "pattern": "^[a-z]{2,3}(-[A-Za-z0-9]{2,8})*$"
    },
    "wikidata_id": { "type": "string", "pattern": "^Q[1-9][0-9]*$" },
    "confidence": { "type": "number", "minimum": 0, "maximum": 1 },
    "id_list": {
      "type": "array",
      "minItems": 1,
      "uniqueItems": true,
      "items": { "$ref": "#/$defs/uuid" }
    },
    "box": {
      "type": "object",
      "additionalProperties": false,
      "required": ["x", "y", "w", "h"],
      "properties": {
        "x": { "type": "integer", "minimum": 0 },
        "y": { "type": "integer", "minimum": 0 },
        "w": { "type": "integer", "minimum": 1 },
        "h": { "type": "integer", "minimum": 1 }
      }
    },

    "submission": {
      "type": "object",
      "additionalProperties": false,
      "required": ["id", "created_at", "client", "ocr", "licence"],
      "properties": {
        "id": { "$ref": "#/$defs/uuid" },
        "created_at": {
          "description": "When the client finished the run (UTC). The master records its own submitted_at on arrival.",
          "type": "string",
          "format": "date-time"
        },
        "client": {
          "type": "object",
          "additionalProperties": false,
          "required": ["name", "version"],
          "properties": {
            "name": { "type": "string", "minLength": 1 },
            "version": { "type": "string", "minLength": 1 }
          }
        },
        "ocr": {
          "description": "Reproducibility: the same copy read by a better engine is a new submission.",
          "type": "object",
          "additionalProperties": false,
          "required": ["engine", "engine_version"],
          "properties": {
            "engine": { "type": "string", "minLength": 1 },
            "engine_version": { "type": "string", "minLength": 1 },
            "models": { "type": "string" },
            "parameters": { "type": "object" }
          }
        },
        "licence": {
          "description": "Every submission is placed under CC0 (charter, decision 9).",
          "const": "CC0-1.0"
        },
        "vocabulary_version": {
          "description": "Version of the role vocabulary (ROLE, ROLE_MODIFIER, ROLE_ALIAS) the client parsed with, so the master knows which role codes it could have used.",
          "type": "string"
        },
        "has_evidence_frames": {
          "description": "True when the bundle carries frames/*.webp (charter, decision 3: allowed, not mandatory).",
          "type": "boolean"
        }
      }
    },

    "work": {
      "description": "What the credits belong to. A series or a season is never credited as such: credits are read per episode.",
      "type": "object",
      "additionalProperties": false,
      "required": ["kind", "title"],
      "properties": {
        "kind": { "enum": ["movie", "episode"] },
        "tmdb_movie_id": { "type": "integer", "minimum": 1 },
        "tmdb_serie_id": { "type": "integer", "minimum": 1 },
        "season_number": { "type": "integer", "minimum": 0 },
        "episode_number": { "type": "integer", "minimum": 0 },
        "imdb_id": { "type": "string", "pattern": "^tt[0-9]{7,}$" },
        "wikidata_id": { "$ref": "#/$defs/wikidata_id" },
        "title": { "type": "string", "minLength": 1 },
        "year": { "type": "integer", "minimum": 1888, "maximum": 2100 }
      },
      "allOf": [
        {
          "if": { "properties": { "kind": { "const": "movie" } } },
          "then": {
            "not": { "anyOf": [ { "required": ["tmdb_serie_id"] }, { "required": ["season_number"] }, { "required": ["episode_number"] } ] },
            "anyOf": [ { "required": ["tmdb_movie_id"] }, { "required": ["imdb_id"] }, { "required": ["wikidata_id"] } ]
          }
        },
        {
          "if": { "properties": { "kind": { "const": "episode" } } },
          "then": {
            "not": { "required": ["tmdb_movie_id"] },
            "anyOf": [
              { "required": ["tmdb_serie_id", "season_number", "episode_number"] },
              { "required": ["imdb_id"] },
              { "required": ["wikidata_id"] }
            ]
          }
        }
      ]
    },

    "copy": {
      "description": "The encode the client read. It carries no id: the master identifies it by its fingerprint, so two contributors with the same files share one copy. Grouping into an edition is done by the master and the community, from edition_hint, duration and the credits themselves.",
      "type": "object",
      "additionalProperties": false,
      "required": ["fingerprint", "duration_ms", "parts"],
      "properties": {
        "fingerprint": {
          "description": "SHA-256, in lower-case hex, of the lines '<opensubtitles_hash>:<file_size>' of the parts in part_index order, joined by '\\n'.",
          "type": "string",
          "pattern": "^[0-9a-f]{64}$"
        },
        "duration_ms": { "$ref": "#/$defs/ms" },
        "width": { "type": "integer", "minimum": 1 },
        "height": { "type": "integer", "minimum": 1 },
        "fps": { "type": "number", "exclusiveMinimum": 0 },
        "edition_hint": {
          "description": "What the contributor's library says: the Plex {edition-...} tag, FILE_EDITION (Criterion, Remastered...). Free text, never a path.",
          "type": "string",
          "maxLength": 200
        },
        "version_language": {
          "description": "Language of the version the credits come from: a French dubbed copy carries French dubbing credits.",
          "$ref": "#/$defs/language"
        },
        "source": { "enum": ["bluray", "remux", "dvd", "web", "tv", "vhs", "other"] },
        "parts": {
          "type": "array",
          "minItems": 1,
          "items": { "$ref": "#/$defs/part" }
        }
      }
    },

    "part": {
      "description": "One file of the copy, identified by its content. Its path and name are never sent: they are private.",
      "type": "object",
      "additionalProperties": false,
      "required": ["part_index", "opensubtitles_hash", "file_size", "duration_ms", "offset_ms"],
      "properties": {
        "part_index": { "type": "integer", "minimum": 1 },
        "opensubtitles_hash": {
          "description": "64-bit OpenSubtitles hash (size plus first and last 64 KB), 16 lower-case hex digits. Plex computes it already.",
          "type": "string",
          "pattern": "^[0-9a-f]{16}$"
        },
        "file_size": { "type": "integer", "minimum": 1 },
        "duration_ms": { "$ref": "#/$defs/ms" },
        "offset_ms": {
          "description": "Where the part starts in the copy: the sum of the previous parts' durations.",
          "$ref": "#/$defs/ms"
        }
      }
    },

    "segment": {
      "description": "Layer 1: a stretch of one part that carries credits, with its frames (layer 1), text lines (layer 2b) and blocks of credits (layer 3).",
      "type": "object",
      "additionalProperties": false,
      "required": ["id", "part_index", "kind", "start_ms", "end_ms", "detected_by", "layout", "frames", "text_lines"],
      "properties": {
        "id": { "$ref": "#/$defs/uuid" },
        "part_index": { "type": "integer", "minimum": 1 },
        "kind": { "enum": ["opening_titles", "opening_credits_over_action", "closing_credits", "post_credits_scene", "recap", "card"] },
        "start_ms": { "description": "Within the part.", "$ref": "#/$defs/ms" },
        "end_ms": { "description": "Within the part.", "$ref": "#/$defs/ms" },
        "detected_by": { "enum": ["plex_marker", "blackdetect", "scene_change", "text_detection", "manual"] },
        "layout": { "enum": ["rolling", "cards", "graphic", "crawl", "mixed"] },
        "scroll_px_per_s": {
          "description": "For rolling credits: measured scroll speed, which puts every frame on one virtual page.",
          "type": "number"
        },
        "frames": {
          "type": "array",
          "minItems": 1,
          "items": { "$ref": "#/$defs/frame" }
        },
        "text_lines": {
          "type": "array",
          "items": { "$ref": "#/$defs/text_line" }
        },
        "blocks": {
          "type": "array",
          "items": { "$ref": "#/$defs/block" }
        }
      },
      "if": { "properties": { "layout": { "const": "rolling" } } },
      "then": { "required": ["scroll_px_per_s"] }
    },

    "frame": {
      "description": "Layer 1: one image read by the OCR, with its text boxes (layer 2a). Frames without text are not kept.",
      "type": "object",
      "additionalProperties": false,
      "required": ["id", "timecode_ms", "phash", "text_boxes"],
      "properties": {
        "id": { "$ref": "#/$defs/uuid" },
        "timecode_ms": { "description": "Within the part.", "$ref": "#/$defs/ms" },
        "phash": {
          "description": "64-bit perceptual hash, 16 lower-case hex digits: drops duplicates, matches frames between copies.",
          "type": "string",
          "pattern": "^[0-9a-f]{16}$"
        },
        "page_offset_px": {
          "description": "For rolling credits: where the frame sits on the virtual page.",
          "type": "integer"
        },
        "evidence": {
          "description": "Optional cropped image of the frame, inside the bundle.",
          "type": "object",
          "additionalProperties": false,
          "required": ["file"],
          "properties": {
            "file": {
              "description": "Path inside the zip, always frames/<frame id>.webp.",
              "type": "string",
              "pattern": "^frames/[0-9a-f]{8}-[0-9a-f]{4}-7[0-9a-f]{3}-[89ab][0-9a-f]{3}-[0-9a-f]{12}\\.webp$"
            },
            "crop": {
              "description": "The area of the frame the image covers, in pixels of the frame. Absent: the whole frame.",
              "$ref": "#/$defs/box"
            }
          }
        },
        "text_boxes": {
          "type": "array",
          "minItems": 1,
          "items": { "$ref": "#/$defs/text_box" }
        }
      }
    },

    "text_box": {
      "description": "Layer 2a: one line box as the engine read it on one frame. Coordinates in pixels of the frame.",
      "type": "object",
      "additionalProperties": false,
      "required": ["x", "y", "w", "h", "text", "confidence"],
      "properties": {
        "x": { "type": "integer", "minimum": 0 },
        "y": { "type": "integer", "minimum": 0 },
        "w": { "type": "integer", "minimum": 1 },
        "h": { "type": "integer", "minimum": 1 },
        "text": { "type": "string" },
        "confidence": { "$ref": "#/$defs/confidence" },
        "font_height_px": { "type": "integer", "minimum": 1 },
        "is_upper_case": { "type": "boolean" },
        "is_bold": { "type": "boolean" }
      }
    },

    "text_line": {
      "description": "Layer 2b: one line rebuilt across frames on the virtual page, with the text chosen by vote. The pivot of the model: layer 3 can be recomputed from these lines without the video.",
      "type": "object",
      "additionalProperties": false,
      "required": ["id", "y_page", "x", "w", "h", "text", "readings", "agreeing", "confidence", "frame_ids", "first_ms", "last_ms"],
      "properties": {
        "id": { "$ref": "#/$defs/uuid" },
        "y_page": { "type": "integer" },
        "x": { "type": "integer", "minimum": 0 },
        "w": { "type": "integer", "minimum": 1 },
        "h": { "type": "integer", "minimum": 1 },
        "text": { "type": "string", "minLength": 1 },
        "readings": { "description": "How many frames saw the line.", "type": "integer", "minimum": 1 },
        "agreeing": { "description": "How many of them read the chosen text.", "type": "integer", "minimum": 1 },
        "confidence": { "$ref": "#/$defs/confidence" },
        "frame_ids": { "description": "The frames that saw it: the evidence chain.", "$ref": "#/$defs/id_list" },
        "first_ms": { "description": "First time on screen, within the part: the time index of the Wikidata reference.", "$ref": "#/$defs/ms" },
        "last_ms": { "$ref": "#/$defs/ms" }
      }
    },

    "block": {
      "description": "Layer 3a: a heading and the credits under it, which take their context from it.",
      "type": "object",
      "additionalProperties": false,
      "required": ["id", "display_order", "block_type", "line_ids", "credits"],
      "properties": {
        "id": { "$ref": "#/$defs/uuid" },
        "display_order": { "type": "integer", "minimum": 1 },
        "heading_raw": { "description": "As on screen; absent for the first cast list.", "type": "string" },
        "block_type": { "enum": ["cast", "crew", "unit", "vendor_staff", "songs", "thanks", "dedication", "dubbing", "locations", "companies", "legal", "logos"] },
        "unit": {
          "description": "main, second_unit, additional_photography, aerial, or a place as written (\"Morocco Unit\").",
          "type": "string"
        },
        "vendor_entity_ref": { "description": "The company whose staff the block lists.", "$ref": "#/$defs/uuid" },
        "version_language": { "description": "For dubbing blocks.", "$ref": "#/$defs/language" },
        "line_ids": { "$ref": "#/$defs/id_list" },
        "credits": {
          "type": "array",
          "items": { "$ref": "#/$defs/credit" }
        }
      }
    },

    "credit": {
      "description": "Layer 3b: one assertion, an entity in a role, always with the on-screen wording beside the client's interpretation.",
      "type": "object",
      "additionalProperties": false,
      "required": ["id", "display_order", "entity_kind", "name_raw", "line_ids"],
      "properties": {
        "id": { "$ref": "#/$defs/uuid" },
        "display_order": { "description": "Wikidata P1545.", "type": "integer", "minimum": 1 },
        "entity_kind": { "enum": ["person", "company", "place", "song", "work", "other"] },
        "name_raw": { "description": "The name exactly as credited (Wikidata P1932).", "type": "string", "minLength": 1 },
        "entity_ref": { "description": "The entity the client proposes, from entities[]. Absent: unresolved.", "$ref": "#/$defs/uuid" },
        "role_raw": { "description": "The job exactly as credited (Wikidata P13187). Absent for a plain cast or thanks line with no wording.", "type": "string" },
        "role_code": {
          "description": "The base job in the open-credits vocabulary (ROLE.code), as the client parsed it.",
          "type": "string",
          "pattern": "^[a-z0-9_]+(\\.[a-z0-9_]+)+$"
        },
        "role_modifiers": {
          "description": "ROLE_MODIFIER codes, in on-screen order: key, second, assistant, additional...",
          "type": "array",
          "uniqueItems": true,
          "items": { "type": "string", "pattern": "^[a-z0-9_]+$" }
        },
        "role_target_entity_ref": { "description": "The person an assistant works for, or a stunt performer doubles.", "$ref": "#/$defs/uuid" },
        "song_ref": { "description": "When the credit belongs to a song (performer, writer, label) rather than to the work: the song, from entities[].", "$ref": "#/$defs/uuid" },
        "character_raw": { "description": "For cast and dubbing (Wikidata P4633).", "type": "string" },
        "language": { "description": "For dubbing credits (Wikidata P407).", "$ref": "#/$defs/language" },
        "qualifier_raw": { "description": "\"(as ...)\", \"with the participation of\", \"and\".", "type": "string" },
        "line_ids": { "$ref": "#/$defs/id_list" },
        "parse_confidence": { "$ref": "#/$defs/confidence" },
        "is_private_individual": {
          "description": "Backers, thanked persons: stored, kept out of the public view and of contributions (charter, decision 10).",
          "type": "boolean"
        }
      }
    },

    "entity": {
      "description": "Layer 3c: an entity proposed by the client, local to the bundle.",
      "type": "object",
      "additionalProperties": false,
      "required": ["id", "kind", "display_name"],
      "properties": {
        "id": { "$ref": "#/$defs/uuid" },
        "kind": { "enum": ["person", "company", "place", "song"] },
        "display_name": { "type": "string", "minLength": 1 },
        "tmdb_person_id": { "type": "integer", "minimum": 1 },
        "tmdb_company_id": { "type": "integer", "minimum": 1 },
        "imdb_id": { "type": "string", "pattern": "^(nm|co)[0-9]{7,}$" },
        "wikidata_id": { "$ref": "#/$defs/wikidata_id" },
        "company_class": { "description": "COMPANY_CLASS code, for companies.", "type": "string" },
        "place_type": { "enum": ["country", "region", "city", "structure", "studio_facility", "nature"] },
        "country": { "description": "ISO 3166-1 alpha-2, for companies.", "type": "string", "pattern": "^[A-Z]{2}$" },
        "is_private_individual": { "type": "boolean" }
      }
    }
  }
}
